{"assessor":"GPT-5.6 Thinking with GitHub connector","rationale":"All four independently governed child components are now COMPLETED and re-verified on main: deterministic asset inventory, read-only evaluation, bounded local execution, and proposal-only outcome learning. The parent can now advance as a staged repository-local integration program, provided direct parent implementation remains decomposed into a read-only orchestrator, an append-only human review ledger, and a promotion application preview. No external execution, adjacent-repository write, autonomous approval, or Skill mutation authority is granted by this assessment.","expected_effect":{"impact":5,"strategic_fit":5,"revenue_leverage":4,"risk_reduction":5,"recurrence":5,"confidence":4.5},"implementation":{"from_scratch_hours":96,"integration_hours":4,"validation_hours":6,"unknown_buffer_hours":2},"github_scan":{"performed":true,"repositories":["nobutakayamauchi/RTS","nobutakayamauchi/RTS-Skills-"],"queries":["governed execution learning loop integration","read-only orchestrator immutable loop record","append-only human review ledger separation of duties","promotion application preview rollback draft pull request"],"assets":[{"repository":"nobutakayamauchi/RTS","path":"asset_manifest/","ref":"4a2999bc455924d388bed72d80e9d65cae2f5554","kind":"code","reuse_mode":"DIRECT","license_status":"OWNED","estimated_hours_saved":12,"notes":"Provides deterministic cross-repository ownership, provenance, privacy boundaries, and pinned asset references."},{"repository":"nobutakayamauchi/RTS","path":"loop_core/","ref":"4a2999bc455924d388bed72d80e9d65cae2f5554","kind":"code","reuse_mode":"DIRECT","license_status":"OWNED","estimated_hours_saved":16,"notes":"Provides read-only selection, evaluation, recommendation, checkpoint, and current-gate verification."},{"repository":"nobutakayamauchi/RTS","path":"execution_controller/","ref":"4a2999bc455924d388bed72d80e9d65cae2f5554","kind":"code","reuse_mode":"DIRECT","license_status":"OWNED","estimated_hours_saved":18,"notes":"Provides bounded local execution planning, authorization fingerprints, WIP enforcement, budgets, stop rules, checkpoints, and reconstruction."},{"repository":"nobutakayamauchi/RTS","path":"outcome_evidence/","ref":"4a2999bc455924d388bed72d80e9d65cae2f5554","kind":"data","reuse_mode":"DIRECT","license_status":"OWNED","estimated_hours_saved":8,"notes":"Provides privacy-safe governed outcome bundles and exact evidence integrity verification."},{"repository":"nobutakayamauchi/RTS","path":"skill_regression/","ref":"4a2999bc455924d388bed72d80e9d65cae2f5554","kind":"test","reuse_mode":"DIRECT","license_status":"OWNED","estimated_hours_saved":12,"notes":"Provides deterministic baseline/candidate comparison, immutable thresholds, and rollback snapshot verification."},{"repository":"nobutakayamauchi/RTS","path":"learning_proposals/","ref":"4a2999bc455924d388bed72d80e9d65cae2f5554","kind":"code","reuse_mode":"DIRECT","license_status":"OWNED","estimated_hours_saved":10,"notes":"Provides deterministic proposal-only learning records, exact evidence provenance, risk separation, pending human review, and fail-closed authority boundaries."},{"repository":"nobutakayamauchi/RTS-Skills-","path":"rts-skills/manifests/skill_promotion_review.skill.yaml","ref":"66991529519795e62d61874d6a6197ae14e01967","kind":"documentation","reuse_mode":"REFERENCE","license_status":"COMPATIBLE","estimated_hours_saved":4,"notes":"Provides the current inspected promotion-review contract as reference only; it grants no write or application authority."}],"gaps":["No parent integration record currently binds the four child fingerprints into one reconstructable run.","The current human review record is intentionally PENDING and there is no append-only final-decision ledger.","No application-preview contract exists for displaying an adjacent-repository change without writing it.","All committed outcomes remain SIMULATED_ONLY; a later real-run pilot must be separately approved and cannot be fabricated."]},"risks":["A parent orchestrator could accidentally become a new execution authority instead of a read-only coordinator.","A human approval record could be confused with Skill application authority.","A preview feature could drift into adjacent-repository mutation or direct publication.","Private prompts, credentials, customer data, provider payloads, or private repository bodies could enter integrated records.","Synthetic evidence could be overgeneralized before a real-run pilot exists."],"assessment_id":"RTS-BA-000003-001","item_id":"RTS-FRZ-000003","assessment_version":1,"item_version_snapshot":2,"item_fingerprint":"63900f08ec45bdc090caf9602e37dd2aad7a73ffd4c6ca1c005bfc324f594b90","derived":{"benefit_score":95.75,"cost_score":22.22,"reuse_score":83.33,"decision_score":71.83,"reuse_hours_saved":80.0,"net_hours":28.0,"time_saved_ratio":0.8333,"implementation_efficiency":3.43,"cost_effectiveness":3.42,"recommendation":"BUILD_NOW"},"created_at":"2026-07-25T06:44:57Z"}
