{
  "assessor": "RTS governed build assessment — Model Transition Intelligence v1",
  "rationale": "F already owns bounded probe planning/profile synthesis and G owns bounded campaign execution. H adds only a provider-neutral, repository-local evidence-diff layer over immutable old/new official-document bundles. It validates provenance, classifies observable external contract changes, preserves documentation as hypotheses, and emits bounded probe requirements. Network crawling, provider calls, hidden architecture inference, runtime mutation, and automatic profile promotion remain out of scope.",
  "expected_effect": {
    "impact": 5,
    "strategic_fit": 5,
    "revenue_leverage": 3,
    "risk_reduction": 5,
    "recurrence": 5,
    "confidence": 5
  },
  "implementation": {
    "from_scratch_hours": 16,
    "integration_hours": 2,
    "validation_hours": 4,
    "unknown_buffer_hours": 1
  },
  "github_scan": {
    "performed": true,
    "repositories": [
      "nobutakayamauchi/RTS"
    ],
    "queries": [
      "model behavior adaptation probe plan",
      "bounded probe executor campaign limits",
      "external seed provenance exact refs",
      "read only non authorizing transition evidence"
    ],
    "assets": [
      {
        "repository": "nobutakayamauchi/RTS",
        "path": "model_behavior_adaptation/",
        "ref": "0b9c6ac5c0d13c0d5b6c8506017df8188248621a",
        "kind": "code",
        "reuse_mode": "REFERENCE",
        "license_status": "OWNED",
        "estimated_hours_saved": 4,
        "notes": "Reuse bounded probe dimensions, engine identity, conservative profile semantics, and advisory-only authority boundaries."
      },
      {
        "repository": "nobutakayamauchi/RTS",
        "path": "bounded_probe_executor/",
        "ref": "0b9c6ac5c0d13c0d5b6c8506017df8188248621a",
        "kind": "code",
        "reuse_mode": "REFERENCE",
        "license_status": "OWNED",
        "estimated_hours_saved": 3,
        "notes": "Reuse max probe/campaign bounding assumptions and fingerprinted downstream execution boundary."
      },
      {
        "repository": "nobutakayamauchi/RTS",
        "path": "external_seed_corpus/",
        "ref": "0b9c6ac5c0d13c0d5b6c8506017df8188248621a",
        "kind": "design",
        "reuse_mode": "REFERENCE",
        "license_status": "OWNED",
        "estimated_hours_saved": 2,
        "notes": "Reuse exact provenance, countercondition, non-Canon, and external-evidence authority separation patterns."
      },
      {
        "repository": "nobutakayamauchi/RTS",
        "path": "selective_recall/",
        "ref": "0b9c6ac5c0d13c0d5b6c8506017df8188248621a",
        "kind": "design",
        "reuse_mode": "REFERENCE",
        "license_status": "OWNED",
        "estimated_hours_saved": 1,
        "notes": "Reuse bounded output/freshness and no-authority principles."
      }
    ],
    "gaps": [
      "No current component compares old/new official model-document bundles and classifies external execution-contract change severity.",
      "No current component converts documentation deltas into bounded F/G probe requirements while keeping docs claims unverified."
    ]
  },
  "risks": [
    "Marketing wording can be mistaken for a real contract change.",
    "Official documentation can conflict across release notes, API docs and migration guides.",
    "Documentation claims can be mistaken for observed model behavior.",
    "The phrase architecture change can accidentally overclaim hidden neural implementation details.",
    "A severe transition label can be mistaken for runtime authority.",
    "Probe expansion can exceed F/G bounded limits if mapping is not capped."
  ],
  "assessment_id": "RTS-BA-000018-001",
  "item_id": "RTS-FRZ-000018",
  "assessment_version": 1,
  "item_version_snapshot": 1,
  "item_fingerprint": "60a61d818065756d98d6f4448f7994be9d585c60c103c94a05064d93655be8f8",
  "derived": {
    "benefit_score": 94.0,
    "cost_score": 38.1,
    "reuse_score": 62.5,
    "decision_score": 72.5,
    "reuse_hours_saved": 10.0,
    "net_hours": 13.0,
    "time_saved_ratio": 0.625,
    "implementation_efficiency": 1.23,
    "cost_effectiveness": 7.23,
    "recommendation": "BUILD_NOW"
  },
  "created_at": "2026-08-27T09:38:08Z"
}
