{"assessor":"ChatGPT 5.6 Thinking with GitHub connector","rationale":"RTS-FRZ-000004 through 000006 are completed. Since the previous assessment, RTS now contains a privacy-safe three-bundle governed outcome corpus, deterministic baseline/candidate regression fixtures, immutable acceptance thresholds, an immutable rollback snapshot, and a fail-closed local verification path. The stale RTS-Skills verification-runner locator has been replaced in Asset Manifest v2 by the canonical RTS outcome verifier, while the current RTS-Skills promotion-review manifest is retained as a pinned reference-only contract. A proposal-only v1 can now be built without granting Skill mutation, adjacent-repository write, self-approval, or external-execution authority.","expected_effect":{"impact":5,"strategic_fit":5,"revenue_leverage":4,"risk_reduction":5,"recurrence":5,"confidence":4.5},"implementation":{"from_scratch_hours":48,"integration_hours":4,"validation_hours":6,"unknown_buffer_hours":2},"github_scan":{"performed":true,"repositories":["nobutakayamauchi/RTS","nobutakayamauchi/RTS-Skills-","nobutakayamauchi/RTS-Talent-Registry"],"queries":["governed outcome verification corpus evidence classification","baseline candidate deterministic regression rollback snapshot","skill promotion review human approval retirement","current verification-runner replacement asset"],"assets":[{"repository":"nobutakayamauchi/RTS","path":"outcome_evidence/","ref":"cf3782619fdb455087ee574d7570d607c941bc58","kind":"code","reuse_mode":"DIRECT","license_status":"OWNED","estimated_hours_saved":10,"notes":"Provides three reconstructable SIMULATED_ONLY outcome bundles, exact classification rules, evidence hash verification, privacy checks, and permanent NOT_ELIGIBLE promotion boundary."},{"repository":"nobutakayamauchi/RTS","path":"skill_regression/","ref":"2f5c9e8f7db27492e61b6dc11dfb17a708c60c6b","kind":"code","reuse_mode":"DIRECT","license_status":"OWNED","estimated_hours_saved":14,"notes":"Provides pinned baseline/candidate snapshots, six deterministic fixtures, immutable thresholds, zero-regression result verification, and an immutable rollback snapshot."},{"repository":"nobutakayamauchi/RTS","path":"execution_controller/runtime.py","ref":"3b35e84542ee51263d98bb4b60ad3488247504b8","kind":"code","reuse_mode":"ADAPT","license_status":"OWNED","estimated_hours_saved":4,"notes":"Provides bounded local execution state, budget, checkpoint and execution_record semantics for proposal-only evaluation inputs."},{"repository":"nobutakayamauchi/RTS","path":"schemas/execution_record.schema.yaml","ref":"main","kind":"schema","reuse_mode":"DIRECT","license_status":"OWNED","estimated_hours_saved":2,"notes":"Canonical minimal execution result contract."},{"repository":"nobutakayamauchi/RTS","path":"schemas/evidence_ref.schema.yaml","ref":"main","kind":"schema","reuse_mode":"DIRECT","license_status":"OWNED","estimated_hours_saved":1,"notes":"Canonical minimal evidence linkage contract."},{"repository":"nobutakayamauchi/RTS","path":"evolution/RTS_EVOLUTION_ENGINE.md","ref":"main","kind":"documentation","reuse_mode":"REFERENCE","license_status":"OWNED","estimated_hours_saved":1,"notes":"Retains proposal-only evolution and explicit human adoption authority."},{"repository":"nobutakayamauchi/RTS","path":"evolution/RTS_SUCCESS_REPLICATION_ENGINE.md","ref":"main","kind":"documentation","reuse_mode":"REFERENCE","license_status":"OWNED","estimated_hours_saved":1,"notes":"Requires evidence linkage and separates unverified success from repeatable patterns."},{"repository":"nobutakayamauchi/RTS-Skills-","path":"rts-skills/manifests/skill_promotion_review.skill.yaml","ref":"66991529519795e62d61874d6a6197ae14e01967","kind":"documentation","reuse_mode":"REFERENCE","license_status":"COMPATIBLE","estimated_hours_saved":1,"notes":"Current inspected declarative promotion-review contract; reference-only and not implementation authority."},{"repository":"nobutakayamauchi/RTS-Talent-Registry","path":"docs/governance/PROMOTION_RULES.md","ref":"main","kind":"documentation","reuse_mode":"REFERENCE","license_status":"COMPATIBLE","estimated_hours_saved":1,"notes":"Defines repeated-evaluation, rollback/retirement, evidence-state and governance-approval expectations."},{"repository":"nobutakayamauchi/RTS","path":"asset_manifest/snapshots/v002.json","ref":"main","kind":"data","reuse_mode":"DIRECT","license_status":"OWNED","estimated_hours_saved":1,"notes":"Refreshes the stale verification-runner reference and records current canonical outcome verification and regression assets."}],"gaps":["All currently committed outcome bundles are SIMULATED_ONLY and cannot establish external business or user success.","The first implementation must remain proposal-only and must not write to RTS-Skills or any adjacent repository.","Human approval, Implementation Preflight, and build authority are still absent and must remain separate gates.","The RTS-Skills promotion-review manifest is minimal and relies on RTS-side evidence, regression, rollback, and decision enforcement."]},"risks":["Synthetic evidence could be overgeneralized beyond the exact bounded local claim.","A learning proposal could accidentally be treated as promotion authority.","Threshold or rollback checks could be weakened by future schema drift.","Private prompts, credentials, customer data, provider payloads, or repository bodies could leak into learning records.","Adjacent-repository mutation could bypass the human decision boundary."],"assessment_id":"RTS-BA-000007-002","item_id":"RTS-FRZ-000007","assessment_version":2,"item_version_snapshot":2,"item_fingerprint":"b1923902f3c35b92cb2575e019a9651ce8ac5ff6088f86fbde855c24cc7cced3","derived":{"benefit_score":95.75,"cost_score":25.0,"reuse_score":75.0,"decision_score":71.41,"reuse_hours_saved":36.0,"net_hours":24.0,"time_saved_ratio":0.75,"implementation_efficiency":2.0,"cost_effectiveness":3.99,"recommendation":"BUILD_NOW"},"created_at":"2026-07-24T23:00:00Z"}
